category,name,url
universe,A galaxy in space photo – Universe Image on Unsplash,https://plus.unsplash.com/premium_photo-1669839137069-4166d6ea11f4?q=80&w=774&auto=format&fit=crop&ixlib=rb-4.0.3&ixid=M3wxMjA3fDB8MHxwaG90by1wYWdlfHx8fGVufDB8fHx8fA%3D%3D 774w
Space Images & Pictures,Satellite flying on space photo – Free Space Image on Unsplash,https://images.unsplash.com/photo-1446776709462-d6b525c57bd3?q=80&w=870&auto=format&fit=crop&ixlib=rb-4.0.3&ixid=M3wxMjA3fDB8MHxwaG90by1wYWdlfHx8fGVufDB8fHx8fA%3D%3D 870w
moon space,A black and white photo of the moon photo – Moon space Image on Unsplash,https://plus.unsplash.com/premium_photo-1685697414658-ba6e19f7b308?q=80&w=903&auto=format&fit=crop&ixlib=rb-4.0.3&ixid=M3wxMjA3fDB8MHxwaG90by1wYWdlfHx8fGVufDB8fHx8fA%3D%3D 903w
Moon Images & Pictures,Astronaut standing on gray sand photo – Free Moon Image on Unsplash,https://images.unsplash.com/photo-1541873676-a18131494184?q=80&w=418&auto=format&fit=crop&ixlib=rb-4.0.3&ixid=M3wxMjA3fDB8MHxwaG90by1wYWdlfHx8fGVufDB8fHx8fA%3D%3D 418w
Space Images & Pictures,A man standing on top of a rocky hill photo – Space Image on Unsplash,https://plus.unsplash.com/premium_photo-1677511580659-f5fa0675a547?q=80&w=1032&auto=format&fit=crop&ixlib=rb-4.0.3&ixid=M3wxMjA3fDB8MHxwaG90by1wYWdlfHx8fGVufDB8fHx8fA%3D%3D 1032w
HD Grey Wallpapers,Timelapse photography of warped lines photo – Free Grey Image on Unsplash,https://images.unsplash.com/photo-1537420327992-d6e192287183?q=80&w=388&auto=format&fit=crop&ixlib=rb-4.0.3&ixid=M3wxMjA3fDB8MHxwaG90by1wYWdlfHx8fGVufDB8fHx8fA%3D%3D 388w
andromeda galaxy,A very large galaxy in the middle of the night sky photo – Andromeda galaxy Image on Unsplash,https://plus.unsplash.com/premium_photo-1677916317230-d9b78d675264?q=80&w=388&auto=format&fit=crop&ixlib=rb-4.0.3&ixid=M3wxMjA3fDB8MHxwaG90by1wYWdlfHx8fGVufDB8fHx8fA%3D%3D 388w
Space Images & Pictures,Ray of light near body of water photo – Free Space Image on Unsplash,https://images.unsplash.com/photo-1457364887197-9150188c107b?q=80&w=870&auto=format&fit=crop&ixlib=rb-4.0.3&ixid=M3wxMjA3fDB8MHxwaG90by1wYWdlfHx8fGVufDB8fHx8fA%3D%3D 870w
nasa,A close up view of the earth from space photo – Nasa Image on Unsplash,https://plus.unsplash.com/premium_photo-1676296353771-7358fae4f292?q=80&w=1032&auto=format&fit=crop&ixlib=rb-4.0.3&ixid=M3wxMjA3fDB8MHxwaG90by1wYWdlfHx8fGVufDB8fHx8fA%3D%3D 1032w
Space Images & Pictures,Brown planet photo – Free Space Image on Unsplash,https://images.unsplash.com/photo-1443456066412-3e3ea69ee37c?q=80&w=869&auto=format&fit=crop&ixlib=rb-4.0.3&ixid=M3wxMjA3fDB8MHxwaG90by1wYWdlfHx8fGVufDB8fHx8fA%3D%3D 869w
HD Abstract Wallpapers,Multicolored abstract painting photo – Free Abstract Image on Unsplash,https://images.unsplash.com/photo-1484589065579-248aad0d8b13?q=80&w=459&auto=format&fit=crop&ixlib=rb-4.0.3&ixid=M3wxMjA3fDB8MHxwaG90by1wYWdlfHx8fGVufDB8fHx8fA%3D%3D 459w
Space Images & Pictures,Photo of moon surface photo – Free Space Image on Unsplash,https://images.unsplash.com/photo-1447433589675-4aaa569f3e05?q=80&w=580&auto=format&fit=crop&ixlib=rb-4.0.3&ixid=M3wxMjA3fDB8MHxwaG90by1wYWdlfHx8fGVufDB8fHx8fA%3D%3D 580w
Space Images & Pictures,A space satellite hovering above the coastline photo – Free Space Image on Unsplash,https://images.unsplash.com/photo-1460186136353-977e9d6085a1?q=80&w=870&auto=format&fit=crop&ixlib=rb-4.0.3&ixid=M3wxMjA3fDB8MHxwaG90by1wYWdlfHx8fGVufDB8fHx8fA%3D%3D 870w
Space Images & Pictures,Green leafed tree on body of water under starry sky photo – Free Space Image on Unsplash,https://images.unsplash.com/photo-1502318217862-aa4e294ba657?q=80&w=415&auto=format&fit=crop&ixlib=rb-4.0.3&ixid=M3wxMjA3fDB8MHxwaG90by1wYWdlfHx8fGVufDB8fHx8fA%3D%3D 415w
Space Images & Pictures,Digital wallpaper of eclipse photo – Free Space Image on Unsplash,https://images.unsplash.com/photo-1504192010706-dd7f569ee2be?q=80&w=871&auto=format&fit=crop&ixlib=rb-4.0.3&ixid=M3wxMjA3fDB8MHxwaG90by1wYWdlfHx8fGVufDB8fHx8fA%3D%3D 871w
HD Sky Wallpapers,Shooting star in night sky photo – Free Sky Image on Unsplash,https://images.unsplash.com/photo-1489549132488-d00b7eee80f1?q=80&w=387&auto=format&fit=crop&ixlib=rb-4.0.3&ixid=M3wxMjA3fDB8MHxwaG90by1wYWdlfHx8fGVufDB8fHx8fA%3D%3D 387w
Space Images & Pictures,Timelapse photography of light photo – Free Space Image on Unsplash,https://images.unsplash.com/photo-1465788786008-f75a725b34e9?q=80&w=870&auto=format&fit=crop&ixlib=rb-4.0.3&ixid=M3wxMjA3fDB8MHxwaG90by1wYWdlfHx8fGVufDB8fHx8fA%3D%3D 870w
aurora,Northern lights during night time photo – Free Aurora Image on Unsplash,https://images.unsplash.com/photo-1443926818681-717d074a57af?q=80&w=580&auto=format&fit=crop&ixlib=rb-4.0.3&ixid=M3wxMjA3fDB8MHxwaG90by1wYWdlfHx8fGVufDB8fHx8fA%3D%3D 580w
HD City Wallpapers,Satellite view of earth's surface photo – Free City Image on Unsplash,https://images.unsplash.com/photo-1446776899648-aa78eefe8ed0?q=80&w=872&auto=format&fit=crop&ixlib=rb-4.0.3&ixid=M3wxMjA3fDB8MHxwaG90by1wYWdlfHx8fGVufDB8fHx8fA%3D%3D 872w
Space Images & Pictures,Photo of network satellite taking off photo – Free Space Image on Unsplash,https://images.unsplash.com/photo-1457364983758-510f8afa9f5f?q=80&w=870&auto=format&fit=crop&ixlib=rb-4.0.3&ixid=M3wxMjA3fDB8MHxwaG90by1wYWdlfHx8fGVufDB8fHx8fA%3D%3D 870w
